,review,review_en
1045,"六月六号首发买的机器，京东的物流十分快速，今天来评价一下，优点：外观很惊艳，性能配置很强劲，拍照功能很强大性价比很不错，缺点：屏幕发红，外放喇叭一般，用户可用存储空间太小只有45g，有的人有50g可用，不知道是什么原因，系统还是老样子，卡顿时有发生，各种bug不断出现，延续了努比亚的系统优化老传统?，充电充不满时有发生，6.18活动时有人用券2500买到了，才新出的机器十来天就变相的降价了三百元，首发用户很受伤，在说说碎屏险，首发的用户购买机器时碎屏险还没有出来，20号时碎屏险出来了，可是首发用户已经过了购买新机器10天内补购碎屏险的机会，问了京东，还有努比亚官方，都说不可以购买，超过新机购买期限了，你们的原因，推到客户身上，十分生气，首发用户都是真粉丝，老牛仔，才买的努比亚，可是到头来就这么对待首发用户，做为从14年开始到现在买了努比亚z7mini,z7max，z11minis,z17四款机器首发购买的老牛仔，我很受伤，觉得愤怒，不把首发用户，老用户当回事，所以下一次换机很大程度考虑和努比亚说再见了！！！！最后想说一句努比亚！想说爱你不容易！！！","June 6 starting to buy the machine, Jingdong logistics is very fast, today to evaluate, the advantages: the appearance is very stunning, the performance configuration is very strong, the camera is very powerful, the price is very good, disadvantages: red screen, Users available storage space is too small only 45g, some people have 50g available, do not know what is the reason, the system is still the same, Caton has occurred, various bugs continue to appear, continues Nubian system optimization tradition? Charging charging dissatisfied from time to time, 6.18 activities when someone bought vouchers 2500, the new machine ten days to disguise the price of three hundred dollars, the first user was injured, talking about broken screen insurance, the first user to buy When the machine broken screen insurance has not come out, the 20th broken screen out of danger, but the first user has been to buy new machines within 10 days to buy broken screen insurance opportunities, asked Jingdong, as well as Nubian officials say Can not buy more than the deadline for buying a new machine, your reason, pushed to the customer who was very angry, the first user is a real fan, the old cowboy, bought Nubian, but in the end So treat the first user, as from 14 years ago to buy the Nubian z7mini, z7max, z11minis, z17 four machines starting to buy the old cowboy, I was injured, I feel angry, not to the first user, the old user when Anyway, so the next replacement a lot to consider and Nubia said goodbye! ! ! ! Finally want to say a Nubian! Love to say you are not easy! ! !"
1046,好好好好好好好好好好好好,Good Well Well Well Well Well
1047,与图相符。,In line with the figure.
1048,里面的肉真心不怎么多，好多稀糊糊的汤汁。再增加点肉吧。不如另一个厂家的罐头肉多。,"The meat inside really not much, a lot of thin paste soup. Add more meat. Not as good as another manufacturer canned meat."
1049,很好，服务态度也好，我买回家送给我奶奶的。相信她会很喜欢!(人˘︶˘*)♡,"Very good, service attitude Ye Hao, I bought my home to give my grandmother. I believe she will really like! (People ˘) ˘ *) ♡"
1050,细节不够精致，大体还是相符的。,"Details are not refined enough, in general or consistent."
1051,很满意，下次还会买,"Very satisfied, will buy next time"
1052,买来做面包用,Bought for bread
1053,手机不错 配置很好 支持京东,Nice phone configuration support Jingdong
1054,还好，味道不是我喜欢吃的,"Fortunately, the taste is not what I like to eat"
1055,盒子收到！就是小了点，没有想象中那么大！但是盒子完好快递神速给个五星好评吧！,"Box received! Is a small point, not imagined so big! But the box intact courier to a five-star praise!"
1056,口感太差了！坏了不少！不会再买了！,Taste bad! A lot of bad! Will not buy it again!
1057,狗狗喜欢,Dogs like it
1058,真的是一言难尽,Really a word hard
1059,糖化了，里头密密麻麻的看不见是什么图案，挺好吃的，来的货太慢了五六天才来,"Saccharified, there are numerous invisible patterns, very delicious, to the goods too slow"
1060,不知带待机如何 给老爸买的,I do not know how to buy a father with standby
1061,真好,that's nice
1062,无良商家 欺骗客户 商品极度差评 售后服务不给处理，各种说法各种理由的推脱，，，，一星都不想给,"Unscrupulous merchants deceive customers extremely poor evaluation of customer service does not give treatment, all kinds of argument shirk various reasons ,,,, a star does not want to give"
1063,味道好难闻,Taste bad
1064,快递飞快，到手第一感觉香槟金没有那么金，淡淡的也挺好！然后就是机器是全新的，充电插口，耳塞孔未见使用痕迹！最后拍照，性能和续航都很满意；拍照很清晰，但是下面的那个摄像头貌似遮住也没什么变化，不太懂！玩穿越火线大型游戏很流畅，屏幕没发现色差。续航能力很强，轻度两天，中度一天半，重度一天基本可以！系统很好很流畅，国产安卓手机优化最好的系统没有之一！不足的就是自动调节亮度和做工精细这两点！总之，这台手机性价比很高，实用性强，全能机，值得购买！,"Express fast, first hand feeling champagne gold is not so gold, a touch of good! Then the machine is brand new, charging socket, earplugs no trace of use! The last photo, performance and battery life are very satisfied; camera is very clear, but below the camera looks like cover no change, do not understand! Play through FireWire large game is very smooth, the screen did not find color. Life is strong, mild two days, moderate day and a half, a day can be a heavy day! The system is very good and very smooth, the best domestic mobile phone optimization Android system without one! Insufficient is the automatic adjustment of brightness and workmanship these two points! In short, this phone is cost-effective, practical, all-around machine, it is worth buying!"
1065,严格按照说明书上的煮的时间来的，多了就软了，少了还硬。自己配的菜。味道还行。,"In strict accordance with the instructions on the cook time, more soft, less hard. Own food. Taste okay."
1066,小孩很喜欢,Children like it very much
1067,不知道什么原因，没当地买的好吃。,"Do not know what the reason, did not buy locally delicious."
1068,快递太慢。,Express too slow
1069,不好，里面的糖全是。变形了,"Bad, all the sugar inside. Distorted"
1070,东西收到怎么里面不一样，床单也不一样，床单就四个边是一样。,"How things are received inside is not the same, the sheets are not the same, the four sides of the sheets is the same."
1071,还行吧猫还算喜欢,"Okay, I still like cats"
1072,混合得不是很平均，白巧克力太少了~,"Mixed is not very average, too little white chocolate ~"
1073,不错，挺好的,"Nice, very good"
1074,没送还收我运费，打电话态度很嚣张,"Did not send and receive my shipping charges, calling attitude is arrogant"
1075,非常差，巧克力都化了，一点保护措施都没有,"Very bad, the chocolates are all gone, no protection at all"
1076,很好，味道,"Very good, taste"
1077,包装很好，出厂日期也很近，以前买过，味道不错，这次还没尝,"Very good packaging, the date of manufacture is also very close, previously bought, good taste, this has not yet tasted"
1078,正品的、鸡很新鲜、味道不错。 就是童子鸡太小了。,"Genuine, chicken is fresh, good taste. It is too young boy chicken."
1079,煮了水果西米露挺不错的&hellip;&hellip;,Boiled fruit sago lush pretty good & hellip; & hellip;
1080,并不满意的一次购物。本身这是男朋友送的情人节礼物，当天接到卖家电话说拍的美版没有了，只有比利时版本，只有甜度的区别。结果隔天收到货后拍照给男朋友看了下，发现拍的松露，发的金装，价格差一倍，松露800多，金装400多。如果没有拍照给他看，直接当礼物收掉，卖家也不会发现发错货，白白损失400块。联系卖家换货后，再次收到发现收到的货和拍的还是不同，数量不错，也是松露，但是内容没有一颗是一样的。当时卖家电话联系时只说甜度不同，没说会变成另一种东西。再次联系卖家，还跟我强调比利时版本比美版好，美版只是宣传和外形好看。可是礼物不就是喜欢外形好看吗？非常不愉快的购物，也不想再换了，不管有没有被坑。不会再来也不建议其他人购买。,"Not satisfied with a shopping. This is the boyfriend Valentine's Day gift itself, the day the seller received a phone call that the US version is gone, only the Belgian version, only the difference between the sweetness. Results received the goods the next day after the photo taken to her boyfriend looked, and found the truffle, made of gold, double the price, truffle more than 800, more than 400 gold. If you do not take pictures to him, directly when the gift is received, the seller will not find the wrong goods, in vain of 400. Contact the seller after the replacement, once again received the receipt of the goods and beat or shot, the number of good, but also truffles, but the content is not the same one. When talking to the seller when the phone only said sweetness is different, did not say will become another kind of thing. Contact the seller again, also stressed to me that the Belgian version is better than the US version, the US version is only advertised and looks good. However, the gift is not like appearance looks good? Very unpleasant shopping, do not want to change, no matter whether there is pit. Will not come back nor advise other people to buy."
1081,给朋友买的，还可以吧，挺好的,"To a friend to buy, but also, very good"
1082,还不错 已经送给女朋友了,Not bad already for girlfriend
1083,徐福记酥心糖，我最喜欢吃的，快递很快就送到了，感谢！,"Hsu Fu remember crisp candy, my favorite food, express delivery soon, thank you!"
1084,吃着不错,Eat good
1085,味道可以，就是外包装有点脏,Taste can be that the packaging a little dirty
1086,超好看还好吃?,Super nice still delicious?
1087,很满意，挺甜的。,"Very satisfied, very sweet."
1088,螃蟹不错都是活的相信京东,Good crabs are living believe Jingdong
1089,用完就回购，一袋一袋买，,"Replenishment on the back, a bag of bags to buy,"
1090,18块 收我20元 绳子都是坏的 而且没有送的手机壳,18 received me 20 yuan rope is bad and did not send the phone shell
1091,不错不错 服务态度好 快递服务良好速度快 京东购物还不错,Good Good Good service Good express service Good speed Jingdong shopping is not bad
1092,很差很失望，一次又一次的感觉魅族太不好了！这手机真的是有问题，触屏很不灵敏，调亮度的时候移动那个进度条的时候很不灵敏，有时候触控都没反应！,"Very disappointed, again and again feeling Meizu too bad! This phone is really a problem, the touch screen is very insensitive, brightness when moving the progress bar is very insensitive, and sometimes the touch did not respond!"
1093,价格超级优惠，但是还没喂 感觉应该还不错,"Super price concessions, but not feeling good should not be fed"
1094,如果给GG磨牙的话不适合用这个哦，狗狗吃的很快，一般吧。,"If you are not suitable for GG molars Oh, dogs eat quickly, in general."
1095,包装很好 设计的也比较好看 送女朋友最合适了 物流速度超快 很满意的一次购物,Good packaging design is also better to see best girlfriend to send a very fast logistics speed is satisfied with a shopping
1096,不晒图了，全部炸了，油放少了，炸糊了,"Not drying, all fried, less oil, fried paste"
1097,火车吃吃吃好吃吃吃吃吃吃吃吃好火车臭臭臭臭好吃,"Eat, eat, eat, eat, eat, eat, eat, eat, eat, eat, train, stinky, smelly"
1098,猫猫一直吃这种的 特别没有 喜欢 哦好,Cats have been eating this special did not like Oh well
1099,手感很好，单手无压力，跑分很给力，就是这个屏占比有软件不能全屏，比一加5稍微小一点呢，黑边可以接受，值得入手！,"Feel good, no pressure in one hand, run points to force, is the screen can not share the software full screen, a little more than a plus 5 it, the black side can be accepted, it is worth starting!"
1100,很好很喜欢,"It's fine, I like it"
1101,商品很给力，非常满意的一次网购。谢谢老板送的礼物、选这家主要是不含植脂末。,"Goods are awesome, very satisfied with a online shopping. Thank you, the boss sent the gift, choose this is mainly non-fat end of plant."
1102,试用中,In trial
1103,快递很给力，还不错吧,"Express is awesome, not bad"
1104,货我还没收到，怎么一显示我签收呢！,"I have not received the goods, how a show I sign it!"
1105,巧克力还是非常不错的，味道非常好，我最喜欢的口味，寄过来一点事没有， 那一颗星，扣在了快递上，太慢了&hellip;&hellip;北京过来，三四天啦都，，不行呀，,"Chocolate is still very good, the taste is very good, my favorite taste, sent over something not, that a star, buckle in the courier, too slow Beijing over, three or four days friends, no, sorry,"
1106,不错，根图片比起来颜色上要深一些，毕竟图片是美化之后的,"Yes, the root picture is darker than the color, after all, the picture is beautiful"
1107,做活动时候买的，狗狗喜欢吃就是硬道理,"When buying activities, dogs like to eat is the last word"
1108,商家经常不在线，快递速度也着实让人急，要买的话最好提前十天买，商品包装还可以吧，但里面的糖有点瑕疵，没那么好看,"Business is often not online, courier speed is really urgent, it is best to buy 10 days in advance to buy, the product packaging can be, but the sugar inside is a bit flawed, not so good-looking"
1109,用小鱼小虾剁碎后发酵制成的，海腥味较重，很咸,"Fish minced shrimp fermented, heavy smell of the sea, it is salty"
1110,便宜物美价廉,Cheap cheap
1111,包装很好，狗狗喜欢，不错。,"Well packaged, dogs love, nice."
1112,不错，用了一段时间才评价，三副镜片应付所有场合，白天开车用偏光，晚上开车用黄镜，平时出走用墨绿镜！整体偏轻，做工扎实，镜盒非常有质感？唯一不足是换镜片要技巧！,"Yes, it took a while to evaluate, three lenses to deal with all occasions, driving with polarized light during the day and night driving with a yellow mirror, usually leaving with a dark green mirror! Overall light, solid workmanship, the mirror box is very texture? The only downside is the lens to trick!"
1113,差评，速度太慢，说好的2～3天，一星期了还没到，到了也不通知，催单让自己去提，太垃圾了，失败的一次购物,"Bad comment, the speed is too slow, that good 2 to 3 days, a week has not arrived yet, there is no notice, reminder list to mention, too rubbish, a failed shopping"
1114,感觉质量有点不好但是很好吃,Feel a little bad quality but good to eat
1115,大屏幕，手感比较舒服，运行速度还是比较快的！价格也比较实惠！各项功能正在体验中！希望用的时间长一点！,"Big screen, feel more comfortable, faster or faster! The price is more affordable! Various functions are experiencing! I hope a little longer!"
1116,还行～自己闻的很腥，猫咪吃起来还是不错，但是吃不多，剩下就臭了，有点浪费,"Okay ~ I smell very fishy, ​​the cats eat is good, but eat less, the rest of the stinky, a little waste"
1117,这次购物失败，收到糖变形了，。,"The shopping failed, I got the sugar deformed."
1118,包装的很好，还有制冷袋，不错嗯,"Well packaged, as well as refrigeration bags, not bad ah"
1119,！,！
1120,一次购两袋，下次还来，不错,"Buy two bags at a time, the next time, good"
1121,做月饼少不了它，即使放好多，也不感觉甜，做出来的口感跟买的一样,"Make moon cake and ultimately it, even if put a lot, do not feel sweet, make the same taste with the buy"
1122,质量看着行，口感未吃不知，发头不如宣传的好,"Look at the quality of the line, the taste did not eat I do not know, head hair better than publicity"
1123,不是說濃湯的嗎？騙人硬的要命貓咪不是很喜歡吃9隻貓,Is not that soup? Homosellous hardcore cat does not like to eat 9 cats
1124,口感不错，水分比较足，这个价格实惠。,"Good taste, more water, this affordable."
1125,好吃好吃！,delicious!
1126,发货去度快，价格便宜！！,"Delivery to fast, cheap! !"
1127,只想问卖家说好的两包送糖纸，糖纸呢？,"Just want to ask the seller said good two packets of sugar, sugar it?"
1128,买猫粮送的赠品，可是我家猫咪好像不吃这些东西啊！,"Buy cat food to send gifts, but my cat does not seem to eat these things ah!"
1129,送老师的，还可以，里面显得也挺高档的,"To send the teacher, you can, it seems very upscale"
1130,味道真的挺不错 就是小时候吃过的味道 以后还会再买,The taste is really good is the taste of childhood eaten will buy
1131,收到货老妈就炒了一盘，挺好吃的，孩子们都喜欢，正品，下次还会来,"The mother received a fried dish, very tasty, the children love, genuine, will come next time"
1132,味道一般。做披萨拉丝效果也没有(&gt;﹏&lt;)以后会考虑其它的。,Taste normal. No pizza drawing effect (& gt; ﹏ & lt;) We will consider the other later.
1133,东西还不错。宝宝挺喜欢吃的。,Things are not bad. Baby likes to eat.
1134,问了那么多一句都不回，可见服务意识极差,"Asked so many do not return, we can see very poor sense of service"
1135,还不错,not bad
1136,没收到啊,Did not receive it
1137,买个创意吧 糖本身确实差了点,Buy a candy bar itself is indeed a little worse
1138,猫咪喜欢吃还不错。。。,Cats like to eat is not bad. . .
1139,以后常来，非常大爱,"After often, very big love"
1140,各个都跟小铁蛋是的太生了，放了半个月还不能吃。皮厚、核大口感不好，这是这么多年以来最难吃的芒果了。,"Each with a small iron egg is too raw, put for half a month still can not eat. Thick skin, big nuclear bad taste, this is the most unpleasant mango for so many years."
1141,京东严重欺骗消费者！17年2月16号下的单！我一买回来就放在冰箱里了，因为怀孕前期不敢吃太冻的东西，一直放着！今天突然间很口干想吃冰淇淋就那出来了，心想那么久了，买来也有两个月了，会不会过保质期，就顺便看看日期！！一看瓶底我蒙了！16年8月？大家看看！不是我眼睛问题吧？过保质期那么久了！还敢卖给我们！太可怕了！反正我是不敢在京东卖东西了！,"Jingdong seriously deceive consumers! February 16, 17 under the single! I bought it in the refrigerator, because I did not dare to eat too frozen things before pregnancy, has been placed! Suddenly very dry mouth today want to eat ice cream on that out, I thought so long, bought for two months, will not have shelf life, the way to look at the date! ! I look at the bottom of a bottle! August 16? Everyone look! Is not my eye problem? Over shelf life so long! Dare to sell to us! terrible! Anyway, I am afraid to sell things in Jingdong!"
1142,时间稍长了点。口味有点淡，感觉第一次喝有点香味，个人觉得不苦不酸。,"A little longer time. Taste a little light, feeling a little scent for the first time, personally feel not bitter does not acid."
1143,没有吃，给小孩子买的，应该可以吧,"Not eat, buy for children, it should be okay"
1144,东西还没收到显示订单完成,Things have not yet been received to show the order is completed
1145,说实话，快递真心慢，而且送过来的东西都放了半年了，吃着口感不怎么好，我一般都不评的，但是这次购物，真心破坏好心情啊！,"To be honest, courier really slow, but also sent things have been put for six months, eating the texture is not very good, I generally do not comment, but this shopping, really undermined the good mood ah!"
1146,还没开始用，不过看起来不错,"Not yet started, but looks good"
1147,还行 我们都特别喜欢。,Ok we all especially like it.
1148,就是垃圾 是真不吃啊 到是有多少添加剂！,Is rubbish is really not to eat ah how many additives!
1149,挺好的，泡咖啡很方便，口味不错。,"Very good, coffee is convenient, good taste."
1150,褪色严重，有点起毛,"Faded serious, a little fuzz"
1151,送货快，质量好，售后*好多了,"Fast delivery, good quality, after-sales * much better"
1152,下单当天烤制（25下午下单，今天就到了），酥香焦脆，花香四溢，值得点赞的是这包装盒子太美了。 至于只给四颗星的原因吧，首先是我也买了自营的，饼子上面有&ldquo;嘉华&rdquo;二字，这个却没有，这是其一！再这就是快递原因，打电话让喊下去拿，还没等我说完电话就挂了，下去时候是个女的，面无表情，我去拿快递时坐在车里没说一句话，快递包装也是坏的，有个开口，真叫人不爽，考虑到里面有内袋倒没和他去计较！,"Order the next day roasted (25 afternoon orders, today it is), crisp crispy, floral overflowing, deserving of praise is that the packaging box is too beautiful. As for the reason for only four stars, first of all, I also bought a self-employed, above the cake with ""Jiahua"" word, this is not, this is one! And then this is the reason for courier, let the phone call to shout, before I finish the phone hung up, down when it is a woman, expressionless, I went to take the express delivery did not say sitting in the car, express packaging Is also bad, there is an opening, really makes people uncomfortable, taking into account there is no inside the bag and he to care about!"
1153,主子不是很喜欢吃 拉稀,Master does not like to eat diarrhea
1154,开心果，很好吃，收到了就开了一瓶，，日期新鲜，吃完会回购的，好评！五分！喜欢吃的可以下手了，哈哈☠,"Pistachio, very delicious, received a bottle opened, the date is fresh, after the repurchase, praise! Five points! Like to eat can start, ha ha ☠"
1155,货是从丰巢拿的，外包装己破损，其中一包糖开了一个口，太差了。一次最失败的购物,"The goods are taken from Feng Chao, the packaging has been damaged, one of the sugar opened a mouth, bad. One of the most failed shopping"
1156,习惯性好评！！！！！！！,Habitual praise! ! ! ! ! ! !
1157,狗狗很爱吃,Dogs love to eat
1158,这个较苦应该比较有利于健康呵呵,This more bitter should be more conducive to health Ha ha
1159,跟图片不一样！这个看着好丑！！！?,Not the same with the picture! This looks ugly! ! ! ?
1160,手机感觉还凑活，在这个时候价格还是挺便宜的，但是手感很不好，微卡，玩王者荣耀没有高帧率不想折腾，刷了MIUI9虽然比8流畅一些，但是和同样配置的一加3T差距还是蛮明显的,"Mobile phone feels lively, at this time the price is still very cheap, but the feel is not good, micro-card, play the king of glory no high frame rate do not want to toss, brush MIUI9 although more than 8 smooth, but the same configuration plus 3T gap is still quite obvious"
1161,可以,can
1162,差评，差评&hellip;&hellip;看看这这枕套的花型跟颜色简直是牛头不对马嘴,"Poor review, poor review & hellip; & hellip look at this flower with the color of the pillowcase is simply the wrong head"
1163,非常不错,very good
1164,买了好多次了 好吃,Bought many times delicious
1165,随身带着，没事嚼一片,"Carry with you, nothing chew one"
1166,这不是清远鸡 清远鸡是三黄鸡的一种啊。 这个还是哈喇味的。生产日期是2017年1月1日。历经千辛万苦 哈喇味到北京，何苦来坑人！京东的生意 买后优 惠购 就这样耍 无耻之极！,"This is not Qingyuan chicken far chicken is a kind of three yellow chicken. This is still hala flavor. The production date is January 1, 2017. After all the painstaking efforts to Beijing, why bitter people! Jingdong buy post-sale concessions so play shameless!"
1167,还是买贵了，袋装的200克特价11块多,"Or buy expensive, bagged 200 grams special 11 more"
1168,还行挺好吃的,Okay
1169,物流快！商家贴心，油还装在纸箱里，包装完好！一直在京东购这款花生仁油炒菜吃,"Fast logistics! Businesses intimate, oil is also installed in the carton, the packaging intact! Jingdong has been buying peanut oil cooking to eat"
1170,，。。。。。。。。。,，。。。。。。。。。
1171,让开发票都没有开，开发票还要邮费，什么玩意。我上面都写好了开发票都不开，纯粹忽悠人。,"Let open invoices are not open, but also postage invoice, what stuff. I have written all the above invoices are not open, pure 忽悠 people."
