,review,review_en
0,就算保质期一个月，还有一个星期过期的巧克力也拿到平台上卖？,"Even if the shelf life of one month, there is a week out of chocolate also get the platform to sell?"
1,太贵！其他的都可以！,Too expensive! Other can be!
2,很理想 满意,Very satisfactory
3,满满的狗粮！谁要吃,Full of dog food! Who wants to eat
4,太小了，有种上当的感觉,"Too small, a kind of fooled feeling"
5,只要老婆喜欢就好,As long as my wife likes like
6,撇撇撇 太撇了,Skimming write too skimmed
7,一星！ 送给两个对象:一个是雷军！一个是京东！ 先说雷军。 握在手机就像一块玻璃～ 是的，黑色板+黑屏，确实整体黑，但亮屏呢？三边框宽，再加个屏幕的大黑边～握在手机是玻璃吗？不是，是相框！是的，就是相框！四边大黑框的相框！！！ 没有对比，就没有伤害！和一代note放在一起，新MIX2的屏幕就是泥巴屏，显色偏黄，无论你调任何模式，屏幕都是偏黄。 再说18:9的5.99寸细长屏，多出来的下端区域放入三个虚拟键，实际可操作区域和5.7寸的note1没啥进步～ 后置摄像头，白光下拍照一般般，夜间就是渣。前置的就不多说了。 对于这个价位的小米，颜值不如MIX1，屏幕不如note1，摄像头更是鸡肋般的落后！ 雷军，MIX2宣传照的边框你能P更细点吗？如此作为，你不觉得汗颜？ 再说京东！ 9月15没抢购到。21日显示现货，抢到了，却显示要订货，要30日才能有货～和雷军的双簧？预售？ 因为在外地出差抢购的，抢到后却没现货，回到住地，京东发货却不能改收货地址。只能让当地朋友代收，再转发给我，等到手都是收货6天了。 虽然最后没有退货，但是，这应该是最后一台小米了，没有以后！ 下面追评再细说京东一星，坑！,"one star! Give two objects: one is Lei Jun! One is Jingdong! Let's say Lei Jun. Hold the phone is like a piece of glass ~ yes, black board + black screen, really black, but bright screen? Three border wide, plus a big black screen ~ hold the phone is glass? No, it's a picture frame! Yes, it's a picture frame! Large black frame on both sides of the picture frame! ! ! No comparison, there is no harm! Put together with a generation note, the new MIX2 screen is mud screen, color yellow, no matter what mode you tune, the screen is yellow. Say 18: 9 5.99-inch slender screen, more out of the lower end of the area into the three virtual keys, the actual operation of the area and the 5.7-inch note1 nothing to improve ~ rear camera, white light like a normal night is slag. Pre-not much to say. For this price of millet, the value of the color is not as good as MIX1, the screen is not as good as note1, camera is chicken-like backward! Lei Jun, MIX2 promotional photos of the border you can P finer point? So, do not you feel ashamed? Say Jingdong! September 15 did not buy to. 21 shows the spot, grabbed, but it shows that to order, to be available on the 30th ~ and Lei Jun's double spring? Pre-sale? Because travel in the field snapped up, but did not grab the spot, back to accommodation, Jingdong delivery but can not change the delivery address. Only allow local friends collection, and then forwarded to me, until the hands are receiving 6 days. Although there is no return, but this should be the last millet, no later! Followed by the pursuit of detailed Jingdong a star, pit!"
8,质量不是很好。,Quality is not good.
9,手机用了一天，大体还行，加了100的价格。跟手感真的没有6s好，天马屏手感一般。但是苹果不支持双卡，没办法，也知足了，价格就不是在同一个段位的。关键是所谓送的膜，套，耳机，指环，质量真的不行，评论还不给上图。统一上图到这里。手机没什么问题，就不上了，气得！,"The phone took a day, generally okay, plus a 100 price. 6s is really good with the hand feel, Pegasus screen feel in general. But Apple does not support dual-card, no way, contentment, the price is not in the same paragraph. The key is to send the so-called film, sleeve, headphones, ring, the quality is really not, comment not to the map. Unity on the map here. Mobile phone no problem, not on the air!"
10,一般吧，不怎么大,"In general, not very big"
11,信赖京东，质量不错，性价比高，推荐购买～,"Jingdong trust, good quality, cost-effective, it is recommended to buy ~"
12,还可以，，，，，，，，,"is acceptable,,,,,,,,"
13,一般，不是很Q。,"In general, not very Q."
14,给家人买的还不错哦。,Not bad for the family.
15,每个糖只有一半，不饱满，太假了。,"Only half of each sugar, not full, too fake."
16,味道还行，就是好咸太咸了,"Taste ok, salty is too salty"
17,好吃 正品 继续购买支持,Delicious authentic continue to buy support
18,提醒大家谁也别去京东买三星了note8了，产品e和note7一样服务差，质量差，估计还会炸机，买了7天机器死机，系统卡，申请换机，不给换，刚买的时候手机右下角屏幕有块缺失，以为是胶或者脏东西，第十天我休息去给手机贴膜，结果贴膜的师傅说你手机这块有损坏吧？仔细一看屏幕有一个白点，右下角位置，再次申请换货，结果售后的男的给我打电话用套路问我你收到是好的吗？我说可能是好的，结果三星售后就跟我说你看你收到是好的，现在说屏幕有问题，那就是后期磕碰的，想问一下，我买到手机右下角这么点点，我也没仔细看，觉着是脏东西，就没在乎，现在三星售后就抓住不放了，还最后不给换也不处理，直接说返给20块钱卷，不管了，我花7000块钱买个手机，天天心疼的和宝似得，我闲着没事摔它啊？三星，韩国产品售后就是差，服务太差，劝大家都别买三星note8，谁买谁后悔。,"Remind everyone who do not go to Beijing to buy a Samsung note8, e and note7 product poor service, poor quality, it is estimated will be fried, bought a 7-day machine crashes, system card, apply for replacement, do not change, just bought When the cell phone there is a missing piece in the lower right corner of the screen, that is glue or dirty things, the tenth day I go to the phone to rest the film, the result of the film that your cell phone is damaged, right? A closer look at the screen has a white point, the lower right corner of the position, once again apply for replacement, the results of the sale of the man to call me Routine Q. Did you receive is good? I said it may be good, the result told me Samsung aftermarket you see you see you received is good, and now that the screen is a problem, that is late bump, would like to ask, I bought the phone so that the lower right corner, I also Did not look carefully, I feel it is dirty things, do not care, and now Samsung seize the sale, but also do not change the last deal, do not say directly back to 20 dollars, no matter, I spent 7000 dollars Buy a cell phone, treasure every day and feel like, I am free to throw it idle ah? Samsung, South Korea is poor after-sales service, poor service, advise everyone not to buy Samsung note8, who regret buying who."
19,润喉的，之前买过很多种，这个品牌是第一次买，只希望好用有效。,"Throat throat, before buying a lot of species, the brand is the first time to buy, only hoping to use and effective."
20,送的试吃 狗狗吃了挺好的,Try to eat the dog to eat very good
21,好大的白白的棉花糖，,"Big white cotton candy,"
22,不错 味道蛮好的 最大的缺陷 就是缺货 这个问题很严重,Good taste is just fine The biggest flaw is the stock shortage is a serious problem
23,宝贝收到了，真心不错,"Baby received, really good"
24,质量还行，红色很喜庆，快递也快，店家摆放盒子也很整洁，总体很喜欢很喜欢，就等着用啦。哈哈。。。,"Quality is OK, red is festive, express delivery is also fast, the store is also very neat box, generally like to like, just wait to use it. Haha. . ."
25,老婆很喜欢，口味不错，玫瑰也好看，谢谢商家和快递小哥,"Wife is like, taste good, rose is also good-looking, thank you businesses and courier brother"
26,好不错，就是没什么味道？？？？？？？,"Okay, is that no taste? ? ? ? ? ? ?"
27,真差，味真重，臭死了，差差差差差差差差差差差差差差差差差差差差差差差差差差差差差差差差差差差差差差差,"Really bad, really heavy taste, stinks dead, stupid difference, stinky"
28,很好，女朋友喜欢,"Well, girlfriend likes it"
29,一般吧。还是周黑鸭好吃,so so. Black duck or delicious week
30,不错，挺好，快递也快，都吃了挺好吃，日期都是新的,"Good, very good, express delivery is fast, eat delicious, the date is new"
31,还好，凑单买的，方便便宜,"Fortunately, buy together, convenient and cheap"
32,狗就喜欢吃这些东西，看到了就很兴奋。,"Dogs like to eat these things, I saw very excited."
33,明明要5个，缺货就拿这个填充，过分,"Obviously to 5, out of stock to take this fill, too much"
34,货物已收到，外箱没有封口，而且里面的这个货袋子也没封口，我真不知道你们怎么包的装，朋友推荐我去买南极人了，而我还是买了彩虹，今明两天我在试一下用起来怎么样，如果不行，我就退货。看到这个货给我的印象不是新的。,"The goods have been received, the outer box is not sealed, and the inside of the goods bag is not sealed, I really do not know how you pack the equipment, my friend recommended me to buy the Antarctic people, and I still bought a rainbow, today and tomorrow I Try it out for use, if not, I will return it. The impression that I have seen on this shipment is not new."
35,还可以啊孩子挺爱吃的。,It's okay
36,好吃，,"good to eat,"
37,摸起来不错!,Feel good!
38,邮寄时间长 坏了好几个,How long have you been shipping mail?
39,包装好小巧，也是我喜欢的类型，与同学一起分享，甜蜜。,"Packed compact, but also my favorite type, share with classmates, sweet."
40,感觉落寞门可罗雀,Feel lonely door
41,慢死了，好烦他们。,"Slow, so annoying them."
42,不好不好不好不好不好不好不好不好不好不好,Poor Good Good Poor Good Poor Poor Poor Poor Good Poor Good Poor
43,这个猫粮我不满意。 气味比较刺激，猫也不太喜欢吃。换用这种粮以后，两位大人都有点拉肚子，有不消化的嫌疑。,"I am not satisfied with this cat food Smell more exciting, cats do not like to eat. After changing to this kind of grain, both adults have a little diarrhea, there is indifference of suspicion."
44,荣耀**号内内容。到浏￥览器中￥打开领取，给五星好评！1.物流非常给力双11期间买的，晚上零晨下单第二天早上就到公司了！神速！ 2.首先从外观说:工艺精湛，一看就喜欢，手感特别好，很轻！适合亚洲人的手握尺寸，机身材料不像iphone那种滑手的感觉，只是手出汗会有点指纹印在上面，不过不是太严重，轻轻擦一下就干净，可以接受！ 3.开机后给我的感觉特别好，画面清晰细腻，色彩饱和度很高！冲着这个价格的手机这里就可以给五星，良心企业！ 4.这点是用了几天后才来评价的，第一小点:指纹识别传感器非常快，比我之前用的所有手机都快，神一样的速度！给五星！第二小点:电池，我们关心的续航能力一点不马虎，充满电正常工作使用微信、微博、打电话、邮箱等能用一天约17-18小时吧！正常晚上睡觉前充电就可以，白天尽情使用！不算最好，但能接受！第三小点:华为应用市场下载软件非常安全，这点是企业对消费者的负责行为，没有多余的插件！给五星！第四小点：要赞一个华为荣耀9自带的手机软件，流畅简约，应用便捷，个人用了几天下来感觉比ios更人性化，更懂主人的使用习惯！谈到这里有点个人的,"Glory ** number content. To browse ¥ browser open in order to receive, to five-star praise! 1. Logistics is very awesome to buy double 11 during the morning and order at dawn the next morning to the company! Speedy! 2. First of all from the appearance that: exquisite workmanship, a look like, feel very good, very light! Suitable for Asian hand size, fuselage material is not like iphone that kind of slider feeling, just hand sweat will be a little fingerprints printed on top, but not too serious, gently wipe it clean, acceptable! 3. Boot feeling very good to me, the picture is clear and delicate, high color saturation! Directed at the price of mobile phones here can give five-star, conscience business! 4. This is a few days later to evaluate, the first little: fingerprint sensor is very fast, faster than all the phones I used before, God the same speed! Give five-star! The second spot: the battery, we care about the battery life a bit not sloppy, fully charged normal use WeChat, microblogging, phone, email, etc. can use about 17-18 hours a day! Normal night before bed can be charged, enjoy the use of daytime! Not the best, but can accept! The third spot: Huawei application market Download software is very safe, this is the business responsible for the consumer behavior, there is no extra plug-ins! Give five-star! Fourth dot: you want to like a HUAWEI glory 9 comes with the phone software, smooth and simple, easy to use, the individual spent a few days feeling more humane than the ios, and better understand the owner's habits! Talking about here a bit personal"
45,还没用，不知道怎么样。回来上边的稍微有点扁不知道会不会影响,"Not used, do not know how. Back to the top a little bit flat do not know will not affect"
46,抱着试试看买的这款手机，收到货后真是惊呆了，比想象的好很多，无论是客服还是快递都非常满意，下次还会来的。京东的商品就是好。,"Hold Trying to buy this phone, after receiving the goods really shocked, much better than expected, whether customer service or express delivery are very satisfied, the next will come. Jingdong's product is good."
47,挺好的，划算。,"Very good, cost-effective."
48,还可以，但到货包装很烂了，都开了，里面是散装的用塑料袋包的。,"It's okay, but the packaging is poorly packed and it's open. There's a plastic bag in bulk."
49,很好，正品，已经第二次购买了，下次继续购,"Very good, genuine, has a second purchase, the next to continue to buy"
50,没有之前的货好了。。。。。。,No good goods before. . . . . .
51,物流快，东西包装很好，应该是真品，好评,"Fast logistics, packaging things well, it should be genuine, praise"
52,糖收到，味道正宗，就是保装太差，就连最简单的超市塑料袋3个都是坏的，还没有保质期。,"Sugar received, the taste is authentic, is poor protection, even the simplest supermarket plastic bags 3 are bad, there is no shelf life."
53,还不错哦，第三次购买哦好好好好好好好好好好好好好好好好好好好好好好好好好好好好好好好好好好好好好好好好好好好好好好好好好好好好好好好好好好好好好好好好好好好好好好好好好好好好好好好好好好好好好好好好好好好好好好好好好好好好好好好好好好好好好好好好好好好好好好好好好好好好好好好好好好好好好好好好好好好,"Not bad oh, the third time buy oh well good well good well good well good well good good good well good good good good good good good good good good good good good good good good good good good good good Good Good Good Good Good Good Well Good Well Good Well Well Well Well Well Well Well Well Well Well Well Well Well Well Well Well Well"
54,一盒就7个，味道还可以,"A box of 7, the taste is OK"
55,跟我想想中的一样，好好吃，味道杠杠的。特辣，特爽，决定下次在继续购买，,"As I think about it, it tastes good and has a good taste. Special hot, special cool, decided to continue buying next time,"
56,不好，冰袋化了，买的时候天还不冷，打开肉都不新鲜了，做生鲜食品这样的保鲜水准太不靠谱了。第一次京东购物一颗星。,"Not good, ice bag, bought when the day is not cold, open the meat is not fresh, so fresh food so fresh standard too fly. The first Jingdong shopping a star."
57,发货快，价格合理，好吃。看起来是正品。,"Fast delivery, the price is reasonable, delicious. Looks genuine."
58,价格提高后再打折,After the price increase discount
59,发货快，日期新鲜,"Fast delivery, fresh date"
60,收到的罐头全部都挤压变形很严重！！有三罐被挤开封口了，洒了很多出来！包装太差，都不会固定一下，不会再来买了！,"All canned crushed received deformation is very serious! ! Three cans have been squeezed open, and spilled a lot! Poor packaging, will not be fixed, will not buy it again!"
61,好好好好好好,Good and well
62,和超市买的味道一样,And the supermarket to buy the same taste
63,凑单买的，还好，还好！,"A single buy, okay, okay!"
64,快递很快，隔天就到了。收到后很惊喜，日期也新鲜，但是蒸熟后掰开来里面都是黑色的东西，没有黄，失望,"Express soon, arrived the next day. After receiving a very pleasant surprise, the date is fresh, but after steamed broke apart which is black, no yellow, disappointed"
65,这个牌子的月饼太差劲了，一点也不好吃，而且物流也是很慢，以后不会再买了。,"This brand of moon cake too bad, not good at all, and the logistics is very slow, will not be bought later."
66,品质很好，送货速度很快,"Good quality, fast delivery"
67,很好很好很好,Very good Very good
68,太差了，说了小心露气的，结果还是弄了个漏气的，都断了，太无语了，再不会买了,"Too bad, and said carefully gas, the result is still got a leak, all broken, too speechless, will not buy"
69,挺好喝的，但是有冲不开的，不知道是什么？玫瑰花吗？,"Very good to drink, but there is not open, do not know what? Rose?"
70,出差回来就迫不及待的打开了，颜值是相当的高。开机以后感觉真心不错。物有所值。值得购买。屏幕显示相当的好。,"Can not wait to open the back of the business trip, Yan value is quite high. Feel really good after boot. Value for money. worth buying. The screen shows pretty good."
71,标注净含量4KG称了一下3.9KG，为什么少了二两，谁能给我解释一下，欺骗消费者吗？狗粮还可以，狗狗挺爱吃的。,"Mark the net content of 4KG said a bit about 3.9KG, why two or two, who can explain to me, to deceive consumers? Dog food is OK, the dog is very loving."
72,不错，挺新鲜的,"Nice, very fresh"
73,东西不错，主要是媳妇喜欢就好，东西情人节及时赶到，没白瞎我加的顺风钱。,"Things are good, like the daughter-in-law is like something, Valentine's Day arrived in time, no blind I added the wind money."
74,烤馍片味道不错，香脆美味，好吃。口味多样化。米多奇，您的唯一 ！ (￣～￣),"Baked slices taste good, crispy delicious, delicious. Diversified tastes. Midoqi, your only! (~ ~ ~)"
75,还可以,is acceptable
76,怎么化了，全黏在一起，不过味道不错。量少了。,"How come, all stick together, but taste good. Less"
77,收到货之后还有两天就到保质期了，差评差评,"There are still two days after the receipt of the goods to the shelf life, bad review bad review"
78,物流太慢了，冰都融化了，不知道还能不能吃,"Logistics is too slow, the ice melted, do not know can not eat"
79,赠品不错？,Good gifts?
80,难吃的要死，这是我买过最难吃的汤圆，都不想评价,"Too bad to die, this is the most unruly rice dumpling I bought, do not want to comment"
81,东西是挺好，这次包装给压力，太影响心情,"Things are good, this time to the pressure of packaging, too affect mood"
82,狗狗很喜欢吃,Dogs like to eat
83,口感很细腻，甜度适中，大爱。吃完还会回购。不过收到货好多都化了，希望下次在箱子里放冰袋,"Very delicate taste, sweetness, love. Eat will repurchase. However, received a lot of goods have changed, I hope the next in the box to put the ice bag"
84,海参看上去没有图片上的大，分量刚好2小碗，有点少。还是挺好喝的。,"Sea cucumber does not look large on the picture, the weight just 2 small bowl, a little less. Still quite good to drink."
85,服务很烂,Bad service
86,京东超市专供品，应该是正品吧，用来做蛋挞的专用原料，感觉还不错！,"Jingdong supermarkets for products, it should be genuine, used to make egg tarts for the special raw materials, I feel pretty good!"
87,吃着味道挺好，有优惠就更完美了,"It tastes good, the offers are more perfect"
88,好多都撞坏了,A lot of crashes
89,货品没问题～快递包装略简单了些～,No problem goods ~ Express packaging a bit simpler ~
90,挺好,very good
91,好吃，价格实惠，不错！,"Delicious, affordable, not bad!"
92,好吃 就是这个味道,Delicious is this taste
93,感觉没有比瑞吉奶糕好，只是这次买没有小包装的奶糕。买的这个俱乐部的。只能相信上边的配方是真实的。因为一直吃比瑞吉的。感觉这种的稍差,"I feel no better than the St. Regis milk cake, but this time there is no small package to buy milk cake. Buy this club. Can only believe that the above formula is real. Because I've been eating more than St. Regis. Feel this kind of slightly worse"
94,猫咪很喜欢吃，所以又下单了。,"Cats like to eat, so they ordered again."
95,我要的5个羊肉，2个蔬菜，3个牛肉，来了5个牛肉，4个羊肉一个蔬菜，我要的发票也没有,"I want five lambs, two vegetables, three beef, five beef, four lambs and one vegetable, and I have no invoice"
96,还行 没有失望 闪闪的很亮眼,OK no disappointment sparkling very bright
97,送货慢，几天才到，密封包装，收到都是死的，个头小，还好死不久，未臭，能吃，第一次在京东给差评,"Delivery is slow, a few days before, sealed packaging, received are dead, small, but fortunately died soon, not stinky, to eat, for the first time in Jingdong to give negative feedback"
98,没有耳机，没一点细节。一个膜都贴不好，手机充电很烫最好不要一边玩一边充电。性能就不说了一分钱一分货。细节做的不够好,"No headphones, no detail. A film is not good, the phone is hot charging best not to play while charging. Performance does not say a penny. Details are not good enough"
99,我的人都有一个人的时候我就不想再去看了一个人的时候我就不想再去看了,"When I have a person, I do not want to see someone again. I do not want to go anymore."
100,凑合。就是太贵。 刚买就降价了&hellip;,improvise. It is too expensive. Just bought a price cut & hellip;
101,手机还不错，还送了手机套和钢化膜，且还有优惠价喔！,"Phone is not bad, but also sent a phone sets and tempered film, and there are discounts Oh!"
102,买了很多次了很好,Bought many times very well
103,京东自营食品，配送及时，快递员服务非常好，品质食用后再评价。,"Jingdong own food, timely delivery, courier service is very good, quality evaluation after consumption."
104,箱子烂掉了，但果子还行,"The box is rotten, but the fruit is ok"
105,先买一罐试试看咋样，这个让我想起了那个菠萝罐头,"First try to buy a pot of Zeyang, this reminds me of the canned pineapple"
106,非常好，非常好，物流超快，赞,"Very good, very good, fast logistics, like"
107,物流快，保质期见图，又是买巧克力的时候了。,"Fast logistics, shelf life see the picture, but also buy chocolate time."
108,送货很快，看起来不错，还没开吃，等吃完尝完味道再来评价,"Delivery soon, looks good, not to eat, wait for the finish taste again after evaluation"
109,收到就打开看，很新鲜，还没吃，看着应该味到不错。,"Received to open to see, very fresh, not eaten, watching should taste good."
110,第二次购买了。干净不咸，特别好吃，发货快。,"Second purchase. Clean and not salty, especially delicious, fast delivery."
111,多次购买了，都买原味的，很喜欢，还会再来的。,"Many times to buy, buy the original taste, like it, will come again."
112,今天吃了，很好吃的！不软不硬，味道不错，谢谢了！☺,"Eat today, very delicious! Not soft not hard, good taste, thank you! ☺"
113,看上去还行吧。但愿不被坑。,Looks okay. I hope not pit.
114,好看好好好好好好,Looks good and well
115,很香的耶味好吃，物流也快，就是放蓝店取有点远，希望下次购物可以送到家。,"Yummy delicious yummy, fast logistics, is to take a bit far from the blue store, I hope the next shopping can be sent home."
116,物流有点慢！而且外包装压的不成样！生怕把里面也压坏了！辛好没有！,Logistics is a bit slow! And packaging pressure is not the same! I'm afraid it is also crushed inside! Xin good no!
117,奶片好好吃下次再来,Milk tablets eat well again next time
