,review,review_en
762,咸鸭蛋是不咸不沙不油，还有两个坏的,"Salted duck eggs are not salty, not bad, there are two bad"
763,太绸，弄不动。也没有麦芽的香味！,"Too silk, not moving. No malt flavor!"
764,这个品牌已买了多次，猫咪很喜欢吃。,"This brand has been bought many times, cats like to eat."
765,已经吃了一个了，豆豆很喜欢,"Have eaten one, Peas love it"
766,发货速度快，产品质量不错，一直吃这个，好评,"Fast delivery, good product quality, have been eating this, praise"
767,质量一般，量非常小，不划算，以后不会来买了！,"Quality in general, the amount is very small, not worthwhile, will not come to buy!"
768,好吃，味道很不错，京东的速度一如既往,"Delicious, taste good, Jingdong speed, as always"
769,口感很好，但是包装不咋滴！发过来有很多坏的还有压烂的。,"Taste good, but the package is not drop! There are a lot of bad hair and crushed."
770,不提供发票 发货超级慢 失败的购物,Do not provide invoices shipped super slow failure of shopping
771,物流一般，买了整整一箱子。三只松鼠还是干果好吃。牛板筋油的厉害。而且里面没多少，独立包装的小袋子。味道像豆瓣酱？老干妈？反正特别油腻，我是不喜欢吃。。,"Logistics in general, bought a whole box. Three squirrels or nuts delicious. Beef bull oil powerful. And there is not much, individually wrapped sachets. Taste like bean paste? Laoganma? Anyway, especially greasy, I do not like to eat. ."
772,东西收到，物流太慢,"Things received, logistics is too slow"
773,好多都是坏的,Many are bad
774,质量是不错，就是价格有些高，狗狗长期吃不起呀,"Quality is good, that is, the price is somewhat high, the dog can not afford to eat for a long time"
775,很好。。。。。。。,well. . . . . . .
776,家里人都喜欢,Families like it
777,从自营店里买的第三个乐视了，前两个是乐2。通话特别多，导航特别多，差不多半年就要换个手机。乐视手机性价比还是不错的，质量不错价格也划算，对自营店还是放心点的。发货速度快，派件员特别好！,"From the self-service store to buy a third music, the first two are music 2. Special calls, special navigation, almost half a year will have to change a cell phone. As the price of mobile phones is still good, good quality and cost-effective, self-service outlets or at ease. Delivery speed, sending members particularly good!"
778,然并卵！买了好久才用，温度太低了！,"But with eggs! Bought for a long time before use, the temperature is too low!"
779,送错了,Wrong
780,月饼有吃，香，五仁齐全，服务态度好，送货上门很快！,"Moon cake eat, incense, five kernels complete, good service, delivery quickly!"
781,，,，
782,三天收到货！物流不是很赞，还是同城间的！送的小球没收到，不在包装里！,"Three days to receive the goods! Logistics is not very good, or in the same city! Sent the ball did not receive, not in the package!"
783,看着不错，,"Looked good,"
784,我家拉拉都吃的这个,This is the one I eat in our house
785,等到放软了就全坏了，感觉上当了,"Wait until put soft on the whole bad, I feel fooled"
786,貌似有点慢，全都化了，并且鱼翅的盒子还是打开的,"Seemingly a bit slow, all of them, and the shark fin box is still open"
787,还行吧,Okay
788,感觉没以前的好，以前这款巧克力250G的我一天吃完，现在吃几个就腻了。不知道是自己口感变了，还是巧克力质量降低了,"Not feeling good before, this chocolate 250G I eat the day, eat a few tired. I do not know whether my taste has changed, or the quality of chocolate has been reduced"
789,个头比较小，很干，有些偏硬，没有之前吃过的软，看食用方法写着食用前需要清洗，我都是直接吃，不知道有没有什么不好。,"Smaller, very dry, and some more rigid, not previously eaten soft, read edible methods need to be cleaned before eating, I always eat, do not know if there is any bad."
790,服务挺好，但鸡?的品质及味道有待提高。,"Service is good, but the chicken's quality and taste needs to be improved."
791,太甜，没传说中那么惊艳。,"Too sweet, no legend so amazing."
792,牌子几好，还未试过味道试过它家的鸭掌不错，呢个都不会差得去边,"Brand is good, have not tried the taste tried it's home duck good, it will not be bad to the edge"
793,满意，送人可以,"Satisfied, give as gifts"
794,很满意，狗狗也很爱吃,"Very satisfied, the dog is also very loving"
795,异味，刺鼻，真的给人感觉很难闻。我买了12件衣服，一个碗，店家给我全部装一起没问题，但最起码找个大点的箱子嘛！弄的皱巴巴很好看吗？唉~发的快递既然是邮政，一个字，慢！态度一个字，差！店家很抠门哦！,"Smell, pungent, people really feel very bad smell. I bought 12 clothes, a bowl, the store gave me all installed no problem, but at least find a bigger box! Get wrinkled look good? Alas ~ hair express since it is postal, a word, slow! Attitude of a word, poor! Stingy store Oh!"
796,非常不错，味道也不错，我也实在是不好意思，这么久了，才来评价，总之就是不错，,"Very good, the taste is not bad, I also really sorry, so long, to evaluate, in short, is good,"
797,全部都是青果，果子还没有完全黑，果蒂那一头就开始软了发烂，最差的一次购物。,"All are green fruits, the fruit is not yet completely black, and the end of the fruit is soft and rotten, worst shopping."
798,拿到手全溶了，都不敢拿，放冰箱了,"Get the hand full solution, are afraid to take, put the refrigerator"
799,好吃，味道正宗。,"Delicious, taste authentic."
800,手机送货速度没的说，一天就到了，可是包装也太随便了吧，盒子压成这样，还好手机没事 送的无线充电器没有数据线，要单买，那快递员不送到我指定的地方，害我自己跑远路去取！先用着完了再评论！,"Phone delivery speed did not say, one day arrived, but the package is too casual right, the box pressed into this, okay cell phone no problem to send wireless charger no data cable, to buy, the courier does not send to me Place, run away to myself! First finished over with comments!"
801,很容易坏，不喜欢,"Very easy to be bad, do not like it"
802,品质很好，已多次购买,"Good quality, has been purchased many times"
803,上面都没有写幼犬专用不敢喂,Did not write the puppies above are not dedicated to feed
804,还不错吧。。。。。。。。。。。。。,"its not bad, right. . . . . . . . . . . . ."
805,刚刚不爱吃,Just do not like to eat
806,还可以，分量足！狗狗也还爱吃，赞,"OK, enough weight! Dogs also love to eat, like"
807,总体不错，肥肉也不太多，煮后炒起来也不肥腻，瘦肉不可避免比较柴，必须搭配肥肉一起吃。,"Overall good, fat is not too much, after cooking fry is not fat, lean meat inevitably more, you must eat with fat."
808,总体来说还可以，老年机该有的功能都有，不足的地方就是手机按键灯不够亮，老人有时候在屋里看不清,"Overall, you can, the elderly have some of the features that are inadequate is the phone button light is not bright, the elderly sometimes in the room can not see"
809,客服态度不好，不回答问题，没有礼貌,"Customer service is not good, do not answer the question, no manners"
810,还没用，包装完好,"Not used, well packaged"
811,怎么说呢。 这个巧克力的口感我不太喜欢???但同学说好吃。,"how to say. I do not like the taste of chocolate, but students say delicious."
812,包装很精致啊，我还以为给我发错货了呢&hellip;&hellip;结果看名字对哈哈，味道也还可以吧,"Packaging is very delicate, ah, I thought I gave the wrong goods? The results look at the name Haha, the taste can also be it"
813,还不错，吃的好以后再买,"Not bad, eat well later buy"
814,东西不错，可惜有点少。,"Things are good, but unfortunately a little less."
815,收到时离保质期只有半年了，以为是优惠，原来是促销品，活动商品都有猫腻吗？,"Received from the shelf-life of only six months, that is a preferential, the original is a promotional items, activities, products have a tricky it?"
816,不错不错，不到20块，性价比超级高有木有，就是有点甜了，味道见仁见智了，个人觉得补补,"Not bad, less than 20, cost-effective super-wood, is a bit sweet, the taste of opinion, personal feel"
817,个头大的，好好吃，新鲜,"Big, tasty, fresh"
818,差评！和狗粮一起放在储物箱里送来的，打开后发觉箱子里面都是水，一股狗罐头的味道，狗罐头也有膨胀现象，如此不负责任的卖家相信是没有回头客的，如果有谁看到评价，希望不要再上当,"Bad review! And the dog food together in the storage box sent, open the box inside that is water, a can of dog taste, canned dog also has the phenomenon of expansion, so irresponsible sellers believe there is no repeat customers, if there is Who saw the evaluation, I hope not to be fooled"
819,还可以，狗狗挺喜欢！,"OK, the dog quite like!"
820,买一送一活动价买的，两大盒，独立小包装的小袋果仁不均匀，有的南瓜籽特别多，没有果仁，有的都是果仁，碎颗粒的芒果丁，总得来说每袋的果实就是太不均匀,"Buy one get one activity price to buy, two large boxes, individually packaged small pockets of nuts uneven, and some pumpkin seeds in particular, no nuts, and some are nuts, broken particles of mango Ding, generally speaking The fruit of each bag is too uneven"
821,小泰迪不太喜欢吃，感觉浪费了，好贵的东西，比人吃的都贵。,"Small Teddy do not like to eat, I feel wasted, and expensive things, more expensive than people eat."
822,味道还可以，值得,Taste is also worth it
823,这款狗粮味道挺香，刚拿来狗狗就知道是好吃的，价格也实惠，就是不知道吃了便便臭臭不。除了此订单出现早早自动签收的情况，差点被冒充京东客服的诈骗，一般还是挺好的。跟图上一样！,"This dog food tastes very fragrant, just brought the dog to know is delicious, the price is also affordable, do not know to eat stool is not stinky. In addition to this order early automatic signings appear almost Jingdong customer service fraud, generally quite good. Same with the picture!"
824,很亮堂很实惠,Very bright and very affordable
825,还不错物流快,Not bad logistics fast
826,效果真的很好！,The effect is really good!
827,还可以吧。。。。。。。。。。。。。。。。。。。。,OK. . . . . . . . . . . . . . . . . . . .
828,没有收到没有收到没有收到没有收到,Did not receive Did not receive Did not receive Did not receive
829,这个不适合成狗吃，适合幼犬磨牙，我家狗不到2分钟就没了，感觉不是很好，但是这价格也不能有多好，还赠了一小包狗粮，都不够我家狗一口的，可是那毕竟是赠品?,"This is not suitable for dogs, suitable for puppies molars, my dog ​​less than 2 minutes gone, I feel not very good, but this price can not be good, but also donated a small bag of dog food, not enough for my dog, But after all, is it a gift?"
830,还没吃希望猫咪喜欢吃,Have not eaten cats like to eat
831,没吃到，不知道好不好吃,"Did not eat, do not know whether it is delicious"
832,还可以，她们吃的很开心,"Yes, they are happy to eat"
833,每次吃完三文鱼，都有一种心满意足，三文鱼质量不错，就是能帮助切片就更好了,"Every time you eat salmon, there is a contented, salmon good quality, that is, to help slice better"
834,还可以吧 当办公电话足够了 希望能用个一年两年的 对于三百多元的电话来说已经不错了 用了几天不怎么卡 就是看看微信发短信打电话 电池也大概可以用两天吧,But also when the office phone enough hope to use a year and two years for more than 300 yuan phone is good for a few days with less card is to see WeChat text messaging phone battery can probably use two God!
835,不错!不错,Not bad
836,好小的虾米。这就是传说中的海米吗？个头小而且比较碎，味道一般，150g一小瓶，里面有些还是黑的。生产日期很模糊，看不清楚。不会再买这个品牌的产品了。,"Very small shrimp. This is the legendary hemi it? Smaller and more fragmented, taste normal, a small bottle of 150g, which is still some black. Production date is very vague, can not see clearly. Will not buy this brand of products."
837,服务态度好，里面放有冰袋,"Good service attitude, there are ice packs"
838,物流太慢4天才到不如顺丰,Logistics is too slow 4 days to SF SF
839,送人的礼物，包装不错，价钱便宜。,"Giving gifts, good packaging, the price is cheap."
840,难吃,Unpalatable
841,第五次购买 送礼就是送这牌子,The fifth purchase gift is to send this brand
842,貓咪太挑嘴了，，我看還是會落狗狗肚子裡!!,"Cat too picky, and I think it will fall off the dog stomach !!"
843,去年10月份生产的德芙，打开包装里面巧克力已经有粘连包装袋现象，虽然已经放了物理冰袋，保护措施还可以。,"Dove produced in October last year, open the packaging inside the chocolate has the phenomenon of adhesive bags, although the physical ice pack has been put, protective measures can be."
844,味道还行，但有些湿，大包装有日期，小包装没有日期，不是一整块，基本上是一大一小拼的。,"Taste ok, but some wet, big package has a date, a small package has no date, not a whole, basically a big one small fight."
845,之前吃的皇家的，吃了两年多，最近感觉毛色不太好，出现了泪痕，现在换换这家的试试看，没有很香的味道，很好?先混合皇家的吃，慢慢来。吃完这袋再评价。,"Before eating the royal, eat more than two years, recently felt the coat is not very good, there was a tear, and now try to change this, there is no fragrant taste, very good? Mix first Royal eat, slowly . After eating this bag and then evaluation."
846,包装满分，烂果没发现，但是不够新鲜，味道还可以，很甜，甜到有点腻，一点酸味都没,"Packed full, rotten fruit did not find, but not fresh enough, the taste can be, very sweet, sweet to a little tired, a little sour"
847,性价比超高，狗狗喜欢吃！,"High cost, dogs like to eat!"
848,东西一般般，外面的包装看着还可以，实际还是挺粗糙的，我买的几袋里面都是有破的，都漏了，而且口感也挺不是那么好，反正我是买了一次不会再买第二次,"Things like the general, outside the packaging looked OK, the actual is still very rough, I bought a few bags inside are broken, all leaked, and the taste is not very good, anyway, I bought it once will not Buy again for the second time"
849,挺好的，放心购买,"Very good, rest assured to buy"
850,以前用的是MX6，丢失了 所以继续选择魅族，原因就是魅族的系统，还有就是魅族手机的性价比比较高，同等配置的其他品牌基本售价都在2000以上，所以继续选择我魅族。E2这款手机的待机绝对是没得说，正常使用不玩游戏的前提下1天一冲，在已经装载80款软件的情况下系统使用比较流畅，最大的缺点就是屏幕，屏幕颜色比较怪，可能是价格的原因吧，魅蓝X的屏幕使用很好，和MX6的屏幕一样，E2的屏幕色彩显示比较发黄，使用几天没有发现其他网友说的信号差，无线断流的情况。手机颜值不错，尤其是黑色版本。,"Previously used is MX6, lost so continue to choose Meizu, the reason is the Meizu system, there is Meizu mobile phone is relatively high cost, the same basic price of other brands are configured in more than 2000, so continue to choose Meizu. E2 This phone's standby is absolutely not say that the normal use of the game does not play under the premise of 1 day a red rush in the case of 80 software has been loaded to use the system more smoothly, the biggest drawback is the screen, the screen color is weird, May be the reason for the price, the charm blue X screen is well used, and MX6 screen, E2 color display more yellow, the use of a few days did not find other users say the signal is poor, wireless off the situation. The color value of the phone is good, especially the black version."
851,炒鸡好，一如既往的好，一直信赖京东，送的快，服务好，快递小哥态度好，东西也非常好，满意满意,"Fried chicken is good, as always, has been relying on Jingdong, send fast, good service, courier little brother attitude is good, things are very good, satisfied with satisfaction"
852,发货很快，送货上门，服务超好，质量也非常有保障,"Fast delivery, home delivery, service super good, the quality is also very secure"
853,买给媳妇儿的，希望她喜欢，希望漂漂亮亮，开开心心每一天。,"To buy a daughter-in-law, I hope she likes, I hope beautiful, happy every day."
854,买亏了，*8包,"Lost, * 8 packs"
855,优点：包装袋有档次，鱼块摆放整齐且没冰！ 缺点：15块鱼，5块不新鲜，鱼体泛黄，且有异味，带鱼也不是完整的五条，只有一条是完整的带鱼，中间肉厚的一大段没有，带鱼最好吃的部位没有，只是难以收拾的鱼肚子与鱼尾部位！ 建议：自家吃勉强，过节请客寒酸些！ 感言：表里不一 不是货真价实的东西，徒有其表！ 以后不会再买此牌子带鱼了！,"Advantages: bags have grades, neatly arranged and no ice! Disadvantages: 15 fish, 5 are not fresh, the fish yellowed, and there are pests, octopus is not a complete five, only one is full of octopus, the middle of a fleshy section is not, the best part of the octopus did not eat , It is difficult to clean up the fish belly and fish tail parts! Suggestion: eat their own barely, the holiday hospitality please! Testimonials: Inside and outside is not a real thing, only the table! Will not buy this brand of octopus!"
856,十九八七六五四三二一,1987655321
857,味道不错，价格好贵!,"Taste good, the price is expensive!"
858,东西不错?,Things good?
859,不错，价格便宜,"Not bad, cheap"
860,物流很快，包装完好。,"Logistics is fast, well packaged."
861,物流太不给力了！顺丰还要4天呢？还不如发别的快递！,Logistics is not to force too! SF 4 days yet? Not as good as other courier!
862,跟之前吃的味道不大一样，太甜&hellip;&hellip;,"With the taste before eating is not the same, too sweet & hellip;"
863,有点酸，,A little sour
864,美味，像牛肉，有时候忍不住想吃,"Delicious, like beef, and sometimes can not help but want to eat"
865,一点都不酸,Not acid at all
866,挺好的，发货快，态度好，不错,"Very good, fast delivery, good attitude, not bad"
867,很好吃，但是收到的只有一种。,"Very tasty, but received only one."
868,还行吧。马马虎虎。囤货中,Okay. So-so. Hoard goods
869,我感觉挺好,I feel good
870,请大家千万不要去买，这个店东西都是假的，。包装与实际完全不相符。,"Please do not buy, this shop things are fake. Packaging and the actual does not match."
871,黑巧比较好吃,Black clever is delicious
872,很好吃，不甜，苦味适中，做活动价格给力，快递也给力，马上过年了。时效依然准时,"Very delicious, not sweet, moderate bitterness, to do the activities of the price to force, express also to force, and soon the Chinese New Year. Aging is still on time"
873,地垫太软了,Mat is too soft
874,巧克力早就吃完了，今天刚好有空就来评价，巧克力包装、造型都很漂亮。巧克力也不错，都吃光了，点赞,"Chocolate has long been eaten, today just free time to evaluate, chocolate packaging, shape is very beautiful. Chocolate is not bad, all eaten, like"
875,挺好的！！！,pretty good! ! !
876,好，已经是多次购买了,"Well, it's been purchased many times"
877,第一次用，狗狗年龄大了，不过很喜欢吃，不错,"The first time, the dog is older, but like to eat, not bad"
878,好好好好好好好干！！！！！！！,"Good, good, good, good! ! ! ! ! ! !"
879,很漂亮,very beautiful
880,有玉米，不好吃，口感欠佳。,"There is corn, not tasty, poor taste."
881,。。。。。。 很好。很喜欢,. . . . . . well. like very much
882,看着还不错，但大猫不吃，奇怪,"Looked pretty good, but the big cats do not eat, strange"
883,东西不错，就是物流有点慢。,"Good things, logistics is a bit slow."
884,收到了！一直都在他家买，这次没送袋装的猫罐头！为什么？,"received! Has been buying at his house, this time did not send bags of canned cats! why?"
885,箱子都压扁了，,The boxes are squashed
886,。。。,。。。
887,签收的时候没拆封，拆封的时候发现瓶子碎了，打售后电话直接退款，服务态度赞一个,"Sign the time did not unseal, unpacking found bottle broken, call the phone direct refund, like a service attitude"
888,枣子很好，大家都喜欢吃，值了。,"Date is good, we all like to eat, worth."
889,味道还好，性价比还好！加油！,"Taste okay, good value for money! Come on!"
890,产品外观很好，应该是新机，之前都在京东买过几台魅族了，都很好！先给好评，等用过再来评论！,"The product looks good, it should be a new machine, before buying a few Meizu Jingdong, are good! Give praise, so come back to comment!"
891,质量不错，猫咪很爱吃,"Good quality, cats love to eat"
892,不错，口味很好,"Nice, good taste"
893,口感还行，物流很棒，就是鸭子太小只了，看起来像水鸭不像土番鸭,"Taste okay, logistics is great, that is, the ducks are too small, looks like a ducks do not like muscovy duck"
894,嗯嗯可以可以,"Um, I can"
895,不错，硬度够硬，宝宝嚼不断，月份小的宝宝不会担心危险,"Good, firm enough hard, baby chewing constantly, the little baby in the month will not worry about the danger"
896,商品还可以，送货速度像蜗牛，500公里距离不到，用了8天时间，步行跑也早到了,"Goods can also, like snail delivery speed, less than 500 km away, spent 8 days, walking is also running early"
897,挺好吃的，不过太甜了,"Very tasty, but too sweet"
898,味道蛮不错的，包装挺好，宝贝很喜欢，支持一下么么哒,"The taste is pretty good, the packaging is very good, the baby likes it, what about it?"
899,我家主子很喜欢，我就满意了,"My family loves, I am satisfied"
900,不要买，好难吃，太硬了，连个生产日期都没有，3无产品，我买来直接扔掉了,"Do not buy, so unpalatable, too hard, not even a production date, 3 no product, I bought it directly thrown away"
901,不错不错不错不错不错,Nice Nice Nice Nice not bad
902,我一次买了30多袋，非常好吃！主要是价格太超值了！半价半价半价！超市一带13.9京东3元就到手啦！5.9半价买的！谢谢快递小哥每次都是送货上门！一带面4个人吃正好！,"I bought more than 30 bags, very delicious! The main price is too value! Half price half price half price! 13.9 Jingdong supermarket around the hand it! 5.9 Half price to buy! Thank you express brother every time delivery! Around the area 4 people eat just right!"
903,促销满199-100买的，价格超值，非常好吃，薄酥，喜欢咖啡口味，推荐购买。,"Promotions over 199-100 to buy, the price value, very delicious, thin, like coffee taste, it is recommended to buy."
904,超赞！手感好，做工属于工匠级，操作贴心，实用主义,"Awesome! Feel good, workmanship is artisan-level, caring operation, pragmatism"
905,送货服务快捷优质，赞一个。但是，网页上标注有30个饺子，开袋后实际只有25个，少了5个。问一下三全，为什么每包都少那么几个？,"Delivery service fast quality, like this one. However, there are 30 dumplings marked on the webpage, and only 25 are actually opened after opening the bag, with 5 fewer. Ask Samman, why so few per package?"
906,吸取教训，以后还是买京东自营了。店家发货很随便，装果的箱子很脏。三箱有两箱全青全硬邦邦，图上黄黄的是京东自营。和之前京东买的金煌芒不能比。不满意。好在是分量很足。,"Learn lessons, or buy a self-employed after the Jingdong. Store delivery is very casual, loaded fruit box is dirty. There are two boxes of all three boxes of all-green hard state, map yellow is self-Jingdong. Jinguang before buying and Jinguang can not be compared. Not satisfied. Fortunately, the component is very full."
907,挺好的,pretty good
908,质量很好,good quality
909,苦苦的很不错，跟咖啡很搭，所以加一颗星。,"Hard is very good, very take with coffee, so add a star."
